data,label,hard_neg
塔利班在Facebook上伪装成“迷人的女人”从事间谍活,塔利班士兵在脸书上装扮成美女来获取军队的秘,Facebook利润用户群跃升
穆罕默德·穆尔西宣誓就任埃格普提安总,穆尔西宣誓就任埃及总,陆克文宣誓就任澳大利亚新总理
戈尔·维达尔去世，享年86岁：传奇作家、剧作家和政治家去世,著名作家、剧作家戈尔·维达尔逝世，享年86岁,纳尔逊·曼德拉去世现场报道
南非警方枪杀30名矿,南非警方称他们杀害了30多名矿工,警方利兹枪杀一名男子后被捕
奥巴马放宽对年轻移民的递解出境规,美国放宽对年轻人的驱逐规定：Napolitan,奥巴马签署奥巴马医改
一个男人在布雷维克审判中放火自,男人在布雷维克审判外放火自,布雷维克被判21年徒刑
9000名美国海军陆战队员离开冲,9，000名美国海军陆战队将撤离冲绳：声,美军陆战队员基地袭击中丧生
伊拉克袭击杀害将军，四名警,在伊拉克的袭击造成将军和其他4人死亡,巴基斯坦无人机袭击击毙四名疑似激进分子
巴西的“流行歌星牧师”进入了一个巨大的新阶,巴西“流行星祭司”登上猛犸新舞,巴西抗议活动仍
普京宣布俄罗斯总统选举获,普京宣布总统选举获,普京俄罗斯总统选举获胜
罗姆尼宣布保罗瑞安为竞选伙,罗姆尼选择瑞安为共和党竞选伙,保罗机会
爱德华兹对1项罪名宣告无罪，对其他人无效审判,爱德华兹在一项罪名上被判无罪，在另一项罪名上被判无效,政府解除武装举措无效
乌克兰举重运动员被禁赛四,乌克兰科洛布卡被禁赛四,一个男人举重
普京“赢得俄罗斯总统选举,普京赢得俄罗斯总统大,普京俄罗斯总统选举获胜
联合国秘书长发出声音，对中国仍持谨慎态,洞察力：联合国秘书长找到了自己的声音，但对中国仍持谨慎态,联合国秘书长几内亚和平总统选举
旁遮普邮报在罗塔克附近出轨，19人受,旁遮普邮报在哈里亚纳邦罗塔克附近出轨，19人受,土耳其防暴警察塔克西姆广场
乔治·齐默尔曼被控谋杀特雷冯·马,官员称，乔治·齐默尔曼将在特雷冯·马丁案中被起,乔治·齐默尔曼被判谋杀特雷冯·马丁无罪
威胁生命的中西部风,“危及生命”风暴对中西部地区的威,声称珍惜生命
风暴延迟共和党大会的开,暴风骤雨袭击佛罗里达，延迟共和党大,世界大会未来智能手机
迈阿密热火赢得总决,迈阿密热火夺,1983年超级碗迈阿密2717输给华盛顿
日本关闭最后一座核反应,日本本周末关闭了最后一座核电站,一位银行家日本发放大型银团贷款困难日本缺乏专业知识
俄罗斯空军庆祝成立100周,俄罗斯空军成立100周,空军教官面临强奸罪判决
印度尼西亚发生6.1级地,6.1级地震袭击印度尼西亚巴布亚-美国地质调查,印度尼西亚岛外发生6.9级地震
两名美国人在阿富汗动乱开始第五天时丧,阿富汗动乱继续，两名美国军官遇,两名阿富汗士兵受伤
“百万布偶游行”为奥巴马支持美国公共广播公司(PBS)辩,百万布偶三月计划捍卫美国对PBS的支,美国奥巴马就职做
伊朗议会质疑不屑一顾的艾哈迈迪内贾,伊朗议会质疑内贾德总,伊朗议会支持核协议
湖人队1-4先发后主帅迈克-布,湖人1-4先发后解雇迈克·布,不包括律师费其他费用公司预计每股亏损14美分
士兵“回忆不起”大屠,美军士兵“不记得大屠杀,阿富汗阵亡士兵
演员Gazzara去世，享年81,演员本·加扎拉逝世，享年81,纳尔逊·曼德拉去世现场报道
雪崩掩埋了至少100名巴基斯坦士,雪崩掩埋了100多名巴基斯坦士,5名滑雪者科罗拉多雪崩中丧生
农业综合企业：在加州发现的疯牛,美国农业部证实加州疯牛病病,中国农业委员会设立农业技术转让知识产权管理咨询办公室中国知识型农业发展农业技术
阿姆斯特朗离开利夫斯特,阿姆斯特朗从Livestrong站下,两人都关押阿姆斯特朗郡监狱
周五中午，中国股市收盘走高,中国股市周五午盘走,中国股市周五收盘走高
埃及总统选举结果推,埃及选举结果推,埃及总统选举投票
叙利亚部队重新占领阿勒,叙利亚政权试图夺回阿勒颇,叙利亚部队发动阿勒颇袭击
股指期货开盘走,股指期货早盘亏损信,中国股指期货收盘走高12月4日
叙利亚叛军离开被围困的霍姆,叙利亚叛军从被围困的霍姆斯区撤,叙利亚叛军指挥权土耳其转移叙利亚
美国命令非必要工作人员离开苏丹、突尼,美国命令非必要工作人员离开突尼斯、苏,柔佛加冕第五苏丹
埃及对穆巴拉克的批,埃及穆巴拉克危在旦,埃及法院下令释放穆巴拉克
西班牙失业率创新,西班牙申领失业金人数创新,澳大利亚失业率高达5.1%
红十字会称通过谈判停止在叙利亚的战斗以获得援,红十字会就叙利亚停火进行谈判以提供援,叙利亚政府停止袭击
德国议会以压倒性多数支持希腊救援协议,德国议会批准救助希,伊朗议会支持核协议
美国大选：米特·罗姆尼承认失败，巴拉克·奥巴马赢得第二任,罗姆尼在电话中承认奥巴马当,米特·罗姆尼印第安纳州赢得共和党初选
美国政府未正式指定哈卡尼网络为恐怖分,美国指定哈卡尼网络为恐怖分,美国政府停摆实时更新
纽瓦克市长救火邻,纽瓦克市长从着火的房子里救出邻,鲍里斯约翰逊再次当选伦敦市长
刚果叛军杀害公园护林,叛军在刚果东部击毙两名公园护林员,闹翻几年支持一系列敌对刚果民兵组织
上海15人死于液氨泄,上海液氨泄漏造成至少15人死,记者未能接连代表上海合作组织声明置评
叙利亚之友承认反对派联盟是叙利亚人民的合法代,美国、叙利亚之友承认反对派为唯一代,在乎叙利亚人民
波音787梦幻客机起火，库存遭受重,波音787梦幻客机失火后股价暴,波音客机俄罗斯喀山坠毁50人死亡
瑞士游客在印度“轮奸,警方称，瑞士游客在印度被轮奸,印度轮奸受害者奋力拼搏
巴勒斯坦人在约旦河西岸、耶路撒冷与以色列军队发生冲,巴勒斯坦人在W.银行与安全部队发生冲,以色列军队约旦河西岸夜间突袭中逮捕6名巴勒斯坦人
以色列飞机袭击叙利亚境,以色列对叙利亚发动空,联合国以色列袭击叙利亚发出警告
卡尼将在英国央行更替的门槛定得很高,卡尼对英格兰银行的变化设置了很高的门槛,两个女孩空中跳得很高
朝鲜与韩国的家庭团,朝鲜推迟与韩国的家庭团,朝鲜警告韩国演习报复
贝克汉姆宣布退,贝克汉姆退,一个人吹长笛
马特·史密斯四年后离开神秘博,马特·史密斯退出BBC“神秘博士,格里夫·里斯·琼斯梅尔·史密斯生命力量
在国家广场自焚的男子受伤死,在国家广场自焚的人死,一名男子飞往医院国家购物中心放火自焚
前第一夫人芭芭拉·布什离开德克萨斯医,前第一夫人芭芭拉·布什出,乔治·W·布什警告激烈移民辩论
滑雪事故后舒马赫昏,滑雪事故后舒马赫仍在昏迷中挣扎求,一个人正一只狗山上滑雪
11人在中国派出所遇袭身,11人在中国派出所遇袭身,60人尼日利亚牛市遇袭身亡
欧盟各国部长“下定决心”解决骑马丑,欧盟各国部长就马肉丑闻举行危机会,欧盟各国财政部长布鲁塞尔会谈
贾根·雷迪被送往医院，西曼德拉的权力危机仍在继,泰兰加纳：贾根将在星期四住院；塞曼德拉的停电仍在继续,南非曼德拉送往医院
成百上千的孟加拉国服装厂工人生,孟加拉国工厂数百人患,这位女士打碎两个生鸡蛋
泰国抗议者闯入军队总,泰国抗议者袭击军队总,泰国抗议者扰乱预先投票
以色列对叙利亚进行空,以色列对叙利亚发动新的空,一张空火车站黑白照片
五月份房屋开工率上升6.8,五月房屋开工率上升6.8,一个男人吹一支大笛子
古巴卡斯特罗担任拉加共同体主,古巴卡斯特罗接任拉加共同体主,孟加拉国工厂主死亡人数接近350人被捕
齐默曼因超速在得克萨斯州停车，并警告被释放,齐默曼因超速在得克萨斯州停车，并受到警告,齐默曼说被车撞
小行星在地球和卫星之间的拉,小行星飞过地,那人拉小提琴
穆加贝宣布有争议的选举获,津巴布韦：穆加贝在有争议的投票中宣布获,不这有争议
鲁哈尼在伊朗总统选举中领先-初步结,鲁哈尼首次统计伊,世界大国伊朗鲁哈尼领导下重启核谈判
内华达州中学枪击案中2人死亡，2人受,内华达州：2人死亡，2人在中学枪击案中受伤,2人死亡17人受伤
哈马斯对男女混合学校的禁令生,哈马斯在男女混合学校的“禁令,一个男人混合
伊拉克支持埃及镇压穆尔西支持,伊拉克支持埃及镇压穆罕默德·穆尔西的支持,埃及外交部再次敦促停止支持穆尔西抗议活动
Hrithik Roshan，妻子Sussanne分道扬,Hrithik Roshan，Sussanne要离,基地组织阿比扬中抓获70名也门士兵
佛罗里达公寓枪击案后7名死者中有持枪歹,枪击案发生后，7名死者中有一名持枪歹徒。公寓枪,7人死于基督教学校枪击案
令人震惊的是，奥巴马暂停了对叙利亚的打击,奥巴马暂停叙利亚打,民主党打击叙利亚上面临分歧
纳伦德拉·莫迪承诺对巴基斯坦采取强硬立,印度莫迪承诺对巴基斯坦采取强硬立,纳伦德拉·莫迪Narendra Modi拍摄钦奈洪水之旅照片网上疯传
童子军延迟录取同性恋的决,美国童子军推迟投票取消对同性恋的禁,同性恋发育障碍做
小杰西·杰克逊。及妻子承认欺诈,杰西·杰克逊(JesseJackson Jr.)，承认欺诈罪的妻,巴拉克·奥巴马承认美国拥有核武器还要
肯尼迪逝世50周年纪,在肯尼迪逝世50周年之际，达拉斯举行了第一场追悼会,世界哀悼曼德拉逝世
费城大楼倒塌，8-10人可能被,费城的建筑物倒塌；关于被困人员的报,孟加拉国大楼倒塌死亡人数攀升580人
埃及领导人在3个城市实施紧急状,埃及总统宣布三个城市进入紧急状,埃及逮捕穆斯林兄弟会领导人巴迪
涉嫌杀害警察的凶手中枪身,涉嫌杀害警察的人死于枪,凶手逃跑
瑞典驻利比亚班加西领事馆发生汽车炸弹袭击，无人员伤,汽车炸弹击中瑞典驻班加西领事馆，无人受,俄罗斯袭击后撤离驻利比亚大使馆
伊朗希望核谈判能产生“路线图”,在日内瓦举行的伊朗核谈判激起了人们的高度希,伊朗核谈判仍
据报道，朝鲜试射短程导弹,朝鲜发射短程导,朝鲜发射短程导弹
澳门博彩收入2012年创380亿美元纪,澳门博彩业收入创2012年380亿美元纪,1月6月消费集团创造44.7亿美元利润200亿美元收入占花旗集团利润收入53%
四名美国空军直升机机组人员在英国坠机中丧,美国空军直升机机组人员在英国坠机中丧,一架直升机正降落直升机停机坪上
东京将主办2020年奥运,东京赢得2020年奥运会主办,东京股市开盘走低
马来西亚在机场拘留澳大利亚参议,马来西亚将澳大利亚议员扣留在机,马来西亚绑架中国游客
埃及投票通过新宪,埃及人投票表决新宪,埃及新宪法投票
普雷斯顿和英格兰传奇汤姆·芬尼逝世，享年91,前英格兰巨星汤姆·芬尼逝世，享年91,纳尔逊·曼德拉逝世享年95岁
持枪歹徒在巴基斯坦杀害11名外国游,持枪歹徒在巴基斯坦杀害11名外国登山,持枪歹徒巴基斯坦杀害11名外国游客
埃及人投票表决分裂宪,埃及人投票决定修改宪,埃及人投票表决伊斯兰支持宪法
易捷航空董事长辞,英国廉价航空公司易捷航空(EasyJet)董事长辞,瑞安航空公布创纪录利润警告增长放缓
联合国迫切需要大幅增加对叙利亚的援,联合国主要敦促大幅增加对叙利亚的援,联合国叙利亚决议
朝鲜称可能推迟有争议的火箭发射,朝鲜看来将推迟有争议的火箭发射,韩国称朝鲜发射导弹
关键盖茨回忆录震撼奥巴马政,盖茨震撼奥巴马政,埃及宪法关键投票
杰夫·贝佐斯押注2.5亿美元重振“华盛顿邮报,杰夫·贝佐斯为“华盛顿邮报”支付2.5亿美,微软表面未来押注分析师
清剿向朝鲜精英发出令人毛骨悚然的信,清洗金向朝鲜精英发出令人毛骨悚然的信,昨天父母收到通知污染信
泰国的政治抗议使更多的政府部门瘫,泰国抗议者围困更多的政府部,泰国抗议活动暴力事件中升级
亚马逊的贝佐斯将以2.5亿美元收购“华盛顿邮报,亚马逊(Amazon)贝佐斯(Bezos)以2.5亿美元收购“华盛顿邮报”(Washington Post,这项立法改变州收购法布鲁姆菲尔德山陶布曼中心公司TaubmanCentersInc周二一项10亿美元收购赢得委员会批准
独家更新2-埃及亲穆尔西联盟标志着谈判的灵活,独家更新1-埃及亲穆尔西联盟标志着谈判的灵活,埃及军队清除亲穆尔西抗议营地
贝克汉姆赛季末退,大卫·贝克汉姆退出足,一个男人吹一支大笛子
暴风雪使美国东北部陷于停顿,暴风雪横扫美国东北部，封锁道,暴风雪袭击北欧死亡人数6人
埃及内政部长幸免于,埃及内政部长在炸弹袭击中幸免于,军方埃及占上风
埃及“冻结穆斯林兄弟会资产,埃及冻结穆斯林兄弟会基,埃及法庭禁止穆斯林兄弟会
托尼·阿博特宣誓就任澳大利亚新总,托尼·阿博特宣誓就任澳大利亚总,埃及宣誓就任新临时领导人
埃及军队镇压兄弟情,埃及军方打击穆斯林兄弟,埃及军队极力攻击绑架者
轨道故障扰乱滨海湾莱佛士广场之间的列车服,莱佛士广场与滨海湾之间的列车服务中,博科圣地扰乱尼日利亚选举
欧元区失业率创新,欧盟失业创新纪,欧元区失业率创纪录11%
兰斯·阿姆斯特朗向奥普拉坦白一,兰斯·阿姆斯特朗在奥普拉采访中承认使用兴奋,头衔后兰斯·阿姆斯特朗阴谋策略
安迪·穆雷配得上爵士头衔，大卫·卡梅隆,大卫·卡梅隆：安迪·默里值得被封为爵,大卫·米利班德兄弟回到老工党
维尼·琼斯揭示癌症之战新消,维尼？琼斯透露他得了皮肤癌,委内瑞拉乌戈·查韦斯死癌症
叙利亚中部一家面包店遭空袭，数十人死,叙利亚空袭面包店“Dozens被杀,人叙利亚空袭中丧生
奥巴马赞颂曼德拉的灵,奥巴马欢呼曼德拉的灵感效,奥巴马会见祖马曼德拉致敬
联合国称美国无人机侵犯巴基斯坦主,联合国：美国无人机袭击侵犯了巴基斯坦的主,4人死于美国巴基斯坦无人机袭击
这家电子邮件-石油公司询问贸易商有关会见部长的事宜,石油公司询问流氓贸易商与部长会面事,英国石油公司55.5亿美元价格墨西哥湾资产出售普莱恩斯公司
亚洲市场因对美国债务交易的希望而触及3周来的最高水平,亚洲股市触及三周高位，因对美债交易抱有希,世界股市因对欧盟美国经济刺激希望上涨
美国股市在停摆的第三天暴跌,股市在政府关门的第三天下,华尔街股市暴跌
13名儿童死于缅甸清真寺大,缅甸警方说，13名儿童死于清真寺的电力火灾,9名儿童阿富汗袭击中丧生
伊朗驻贝鲁特大使馆附近发生爆,伊朗驻贝鲁特大使馆附近发生两起爆,伊朗驻贝鲁特大使馆发生两起爆炸7人死亡
新奥尔良枪击案19人受,警方：在诺拉母亲节枪击案中19人受,多伦多枪击案两人死亡19人受伤
美国禁止在飞往俄罗斯的航班上携带液体和凝,美国禁止直飞俄罗斯的随身携带液,美国联邦航空局解除美国飞往特拉维夫航班禁令
法官宣判詹姆斯·霍姆斯无,詹姆斯·霍姆斯不认罪-但精神错乱的选择仍在讨论中,明星詹姆斯·加纳致敬
艾伦在信中回应了法罗的虐待指,艾伦针对法罗的虐待指控为自己辩,反堕胎还指反对堕胎
1，000多名囚犯从利比亚的al-Kwei fiya监狱越,1000名囚犯逃离利比亚监,地中海2000多名移民木船上获救
斯诺登的父亲抵达莫斯,爱德华·斯诺登在莫斯科的父,斯诺登厄瓜多尔提供难民文件
中国股市周四收盘走低,中国股市周四收盘走,中国股市周四收盘走低
马尔代夫举行新一轮总统选,马尔代夫举行新一轮总统选,马尔代夫总统警察叛变抗议后辞职
新世界贸易中心宣布为美国最高建筑,一座名为“美国最高建筑”的世界贸易中,朝鲜美国新制裁打击
西班牙火车相撞事故司机面临法官质,西班牙火车司机撞车被法官质,西班牙火车相撞事故中多达50人死亡
菲律宾，叛军达成财富分享协,菲律宾与叛军达成“财富协议,2002年5月初菲律宾马来西亚印度尼西亚签署一项分享恐怖主义情报协定
开创性的以色列电动汽车公司更好的地方折,首屈一指的以色列电动汽车公司即将倒,好奇地方
亲巴基斯坦塔利班军阀在美国无人机袭击中丧,塔利班指挥官在美国无人机袭击中丧,巴基斯坦塔利班头目美国无人机袭击中丧生
叙利亚西北部汽车炸弹炸死20,叙利亚北部汽车炸弹炸死20,叙利亚边境土耳其城镇汽车炸弹炸死20人
五名外国人因在埃及走私毒品被判处死,埃及判处巴基斯坦人5人死刑，罪名是走私毒,埃及判处半岛电视台记者监禁
美国总统罗纳德·里根的前发言人去,前里根发言人拉里·斯皮克斯去世，享年74岁,美国参议员特德·克鲁兹竞选总统
直升机撞进酒馆后恐怕死了三人,三人恐怕在直升机酒吧坠毁后死,三人死美国马拉松炸弹
以色列总理佩雷斯敦促恢复和,以色列总理佩雷斯呼吁恢复和,奥巴马敦促以色列巴勒斯坦克制
奥巴马将于下午1点15分在白宫就叙利亚问题发表讲话。ED,奥巴马将于下午1点15分在白宫就叙利亚问题发表声,比利时国王退位猜测中发表讲话
新强地震袭击破碎的帕克,强烈的新地震袭击震碎的巴基斯坦地区,6.3级地震袭击台湾
热带风暴安德里亚袭击东海,热带风暴安德里亚将滑向东海,热带风暴凯伦袭击美国墨西哥湾沿岸
纽约小姐获美国小姐桂,纽约小姐被封为美国小,报道两人纽约帝国大厦枪击案中丧生
奥地利人在家中博物馆发现藏着56个偷来的头骨,奥地利男子在家中发现56具人头骨后被起,这份报告10月23日发现藏一个调查无关旧三环活页夹
一名男子在国家购物中心放火自,一名男子在华盛顿国家购物中心自,一名男子水管另一名男子喷水
美国国会山遭枪击后被封,现场直播：美国国会大厦在接到枪击报告后被封锁,美国国会记录显示通用汽车召回缓慢
中国法院维持对湄公河谋杀犯的死,法庭维持对湄公河谋杀犯的死刑判,死负责任
以色列部队在西岸拘留5名巴勒斯坦,以色列部队在西岸逮捕5名巴勒斯坦,以色列袭击中拘留巴勒斯坦激进分子
抗议席卷巴西，不顾让,尽管做出让步，巴西各地仍计划举行抗议活,巴西领导人街头抗议危机会谈
奥巴马前往被龙卷风蹂躏的俄克拉何马,奥巴马访问俄克拉何马州遭受龙卷风袭,总统前往巴林
南非偶像纳尔逊·曼德拉住,南非纳尔逊·曼德拉住,纳尔逊·曼德拉纪念仪式
最高法官曼苏尔宣誓就任埃及临时总,阿德利·曼苏尔法官宣誓就任埃及临时总,陆克文宣誓就任澳大利亚新总理
希腊购物中心炸弹爆炸，两人受,雅典购物中心发生炸弹爆炸，2人受,炸弹沙漠中爆炸
三人死亡，包括持枪歹徒，在马里兰州购物中心发生枪击案,马里兰州商场枪击案3人死,新奥尔良母亲节游行枪击案警方搜捕持枪歹徒
埃及法院下令释放穆巴拉,埃及法院下令释放穆巴拉,埃及法院下令释放穆巴拉克
由于卢比崩盘，宝莱坞削减了三分之一的成本,宝莱坞因卢比危机而削减成,吉百利施韦普斯CadburySchweppes计划四年内削减5500工作岗位20%工厂削减收购热潮带来成本
女性将面临更高的汽车保险,女性司机将面临保险费上,禅宗报道高维护不
伊朗，原子能机构在鲁哈尼选举后的首次会谈,国际原子能机构与伊朗举行自鲁哈尼选举以来的首次核谈,伊朗鲁哈尼警告说叙利亚实行统一制度
中国新任总理拒绝美国黑客攻击指,中国总理李克强驳斥美国“毫无根据”的黑客指,中国副总理会见澳大利亚总督
东帝汶在杀戮中禁止武术俱乐,东帝汶在杀戮中禁止武术学,古斯芒东帝汶权力
在巴基斯坦，军队坚决反对其他塔利班分子,巴基斯坦军队坚持与另一个塔利班作,塔利班越狱250名武装分子袭击巴基斯坦监狱后逃跑
以色列部长斯莱姆斯·克里的抵制警,以色列部长抨击克里的抵制警,海军学院发言人罗德·吉本斯中校说令人惊讶
缅甸昂山素季在纷争中敦促政党团,昂山素季在纷争中敦促党派团,缅甸反对派声称昂山素季获胜
白宫，国防承包商讨论自动削减开支的危,白宫，国防公司讨论自动削减开,希腊人抗议进一步削减开支
赞比亚前总统被,赞比亚前总统鲁皮亚·班达被,埃及议会投票前总统选举
美国参议院确认耶伦为美联储下一任主,美国参议院确认珍妮特·耶伦为新的中央银行行,警方确认疑犯抓获
亚洲股市在一连串乐观的数据之后出现反弹,强劲的美国就业数据带动亚洲市场上,亚洲市场中国贸易数据喜忧参半
在印度反强奸抗议活动中受伤的官员死,在轮奸抗议中受伤的印度警察死,抗议活动减少香港官员恢复工作
派系名称比安卡·奥朱克武·阿普加民族领导,比安卡·奥朱克武成为APGA国家领导,两个侵略国闹翻支持敌对派系
美国不能“最终确定”叙利亚的化学武器使用情,美国没有看到叙利亚使用化学武器的确凿证,美国认定叙利亚化学武器
参议院确认耶伦为美联储主,美国参议院确认耶伦为美联储下一任主,警方确认疑犯抓获
两人被发现死于埃塞克斯酒店游泳,一男一女被发现死在埃塞克斯酒店游泳,两人死叙利亚暴力冲突后联合国监测土地
南非为纳尔逊·曼德拉祈,南非团结一致为纳尔逊·曼德拉祈祷和歌,纳尔逊·曼德拉纪念仪式
伊朗总统艾哈迈迪内贾德可能面临与助手一起出席选举的指,艾哈迈迪内贾德可能面临选举出庭指,埃及总统选举
奥巴马取消莫斯科与普京的会,奥巴马取消了与普京的会,莫斯科反普京抗议者人链
奥朗德在事件指控后“威胁采取法律行动,弗朗索瓦·奥朗德威胁对婚外情索赔采取法律行,奥朗德法国总统选举中击败萨科齐
直升机在伦敦火车站附近坠,直升机在伦敦坠,一架直升机正降落直升机停机坪上
日本飞机飞入中国新防卫,日韩军机挑战中国新防卫,日本紧急出动喷气式飞机对抗俄罗斯军机
美国参议院确认珍妮特·耶伦为美联储主,参议院确认珍妮特·耶伦为下一任美联储主,警方确认疑犯抓获
叙利亚军队挺进具有战略意义的反叛城,叙利亚军队对叛军控制的城镇发动进,叙利亚告诉俄罗斯军队撤出霍姆斯
泰国反对派抗议者开始关闭曼,泰国抗议者发动曼谷“关闭,泰国抗议者呼吁大罢工
美俄就叙利亚武器问题达成协议后法国欢呼突,法国欢迎美俄就叙利亚问题达成协,阿盟美俄叙利亚达成协议
安援部队士兵在阿富汗“内部袭击”中丧,英国士兵在阿富汗“内部袭击”中被击,安援部队4名联军士兵涉及阿富汗警察袭击中丧生
瑞士游客在印度被轮,瑞士游客在印度被轮,马来西亚绑架中国游客
小偷抢夺英吉利海峡游泳者定制的轮,小偷偷走海峡游泳者的轮,一个男人游泳
天安门车祸三人死,三人在天安门广场相撞身,三人死美国马拉松炸弹
肯尼亚军队造成商场倒,一位官员说，肯尼亚军队导致购物中心倒塌,·拉登肯尼亚商场袭击事件中持续影响力
芝加哥枪击案显示出加强警力的差,芝加哥枪击案显示出加强警力方面的差,芝加哥少年芝加哥被捕汽车炸弹阴谋
查尔斯王子把普京比作希特,查尔斯王子把弗拉基米尔·普京比作阿道夫·希特,王子洗礼融合新旧
周一收盘时将关注的股,周一将关注的股,周四收盘时关注股票
埃及警方向开罗抗议者发射催泪瓦,开罗警方向抗议者发射催泪瓦,警方抗议者发射催泪瓦斯
著名西班牙弗拉门戈吉他手帕科·德·露西娅去,西班牙弗拉门戈吉他手帕科·德·露西娅逝世，享年66岁,谷歌任命丹尼斯·伍德赛德执掌摩托罗拉
斯诺登在寻求庇护方面遇到障,斯诺登在寻求庇护方面遇到的障,求救寻求庇护恐惧
诺贝尔作家多丽丝·莱辛逝世，享年94,诺贝尔奖得主多丽丝·莱辛逝世，享年94,纳尔逊·曼德拉逝世享年95岁
波士顿爆炸案抓获3名嫌疑,波士顿警方称3人在马拉松爆炸案中被拘,波士顿爆炸案疑犯被控卧床
纽约警察局推特外展事与愿,纽约警察局的Twitter活动适得其,Telstra申请纽约列出中国网站
土耳其搜寻结束，最后一名失踪矿工被发,土耳其搜索结束，最后一名失踪矿工被找,中国失踪飞机搜寻
