data,label,hard_neg
但财务分析师密切关注的软件许可收入下降了21%，至1.076亿美元,作为衡量需求的一个关键指标，许可证销售下降了21%，至1.076亿美元,1月6月消费集团创造44.7亿美元利润200亿美元收入占花旗集团利润收入53%
据报道，21岁的多特森于7月21日被逮捕，并被指控。据报道，他告诉当局，在德内希试图开枪后，他开枪打死了德内希,根据逮捕令证词，多特森于7月21日被捕，此前他告诉联邦调查局特工，当德内希试图向他开枪时，他开枪打死了德内希,逮捕令证词多特森告诉联邦调查局特工德内希试图开枪后开枪打死
北美期货周二开盘低于平价，投资者已准备好第一次尝到季度收益,北美股市周二开盘缓慢，投资者已准备好第一次尝到季度收益,新加坡股市周二开盘下跌0.06%
但文件称，联邦调查局(FBI)从未对巴尤米(al-Bayoumi)进行监控-尽管它收到了有关他是一名沙特特工的信息,但该机构从来没有对al-Bayoumi进行监视-尽管得到了事先的信息，他是一名秘密的沙特特工，报道说,吉尔罗伊警方联邦调查局特工称Gehring很合作周六透露孩子发生事
根据这项研究，自20世纪50年代以来，挪威和瑞典的皮肤癌发病率增加了两倍,这项研究还发现，自20世纪50年代以来，挪威和瑞典的皮肤癌几乎增加了三倍,自上世纪80年代韩国子弹头列车系统
袭击事件中澳大利亚受害者的几名亲属出庭作证，但几乎没有巴厘岛人出席审判,几名澳大利亚遇难者的亲属坐在法庭的前排，但几乎没有巴厘岛人参加审判,内罗毕袭击事件死亡人数59人
此前，该公司在此期间的利润为1，200万美元，合每股0美分,此前，该公司报告在此期间实现了1，200万美元的小幅利润，即每股盈亏平衡,去年第二季度AKSteel利润1620万美元合每股15美分
该公司通过新的大型机将.NET和J2EE支持添加到其企业应用程序环境(EnterpriseApplicationEnvironment，EAE)中,Sapp说，该公司还在其企业应用程序环境开发工具集中添加了.NET和J2EE支持,意大利议会支持新总理
来自佛罗里达州达尼丁高中的外野手瑞安·哈维(Ryan Harvey)被芝加哥小熊队(Chicago Cubs)选为第六名,来自佛罗里达州的高中外野手瑞安·哈维(RyanHarvey)被小熊队选为第六名,CNN高层洗牌中泰娅·瑞安Teya Ryan辞去美国节目总经理一职
现在，布兰卡的美国丈夫、63岁的罗杰·劳伦斯·斯特伦克(RogerLawrenceStrunk)面临菲律宾政府今年2月发出的谋杀指控，菲律宾政府称他是首要嫌疑人,现在，布兰卡的丈夫，63岁的特雷西的罗杰·劳伦斯·斯特伦克(RogerLawrenceStrunk)面临菲律宾政府2月份发出的谋杀指控,29岁雷·布伦特·马什RayBrent Marsh面临虐待尸体盗窃指控
在加拿大，繁荣的美元将再次成为焦点，因为它试图保持在75美分以上(美国)。马克,在加拿大，飙升的美元再次成为焦点，因为它苦苦挣扎，只是未能保持在75美分以上(美国)。马克,系统辩证法焦点慢性慢性
微软已经获得了即时消息功能的专利，该功能在用户与其通信的人输入消息时发出警告,微软已被授予一项受欢迎的即时通讯功能的专利，该功能可显示通话另一端的用户键入消息的时间,土耳其叙利亚难民发出警告
大部分资金，约650亿美元，将用于在伊拉克和阿富汗的军事行动,其中大部分-647亿美元-主要用于在伊拉克和阿富汗的军事行动,东海岸大部分地区
穆尔周二没有立即置评,穆尔周二没有立即做出回应,董事会主席罗伯特·班尼特RobertBennett周二拒绝人事置评米尔斯
雪莱的办公室周五报告说，已经向他报告了575，926个签名,雪莱的办公室周五晚些时候公布了签名数量，并表示，截至目前，县已经报告了575，926个签名,原子能机构报告受到限制
工会官员罗布·奥尼尔(RobO‘Neill)说：“现在已经脱下手套了。,Unifi官员罗布·奥尼尔(RobO‘Neill)说：“已经脱下手套了。,布莱恩·罗布夫BrianRohrbough儿子丹尼尔Daniel科伦拜恩遇害说段录音引发令人不安
“当然，我们所知道的表明，我们应该非常认真地对待他们所说的话，”他补充说,他说：“我们并不是什么都知道，但我们知道的情况表明，我们应该认真对待他们所说的话。,报告补充说旋转操纵公共关系答案辩论
美国国土安全官员周二宣布，政府已选择三家公司制定计划，以保护商用飞机免受肩射导弹袭击,美国国土安全部星期二宣布，它已经选择了三家公司继续研究如何阻止对美国商用飞机的肩射导弹袭击,庞大财产政府保护
包括24名共和党参议员在内的57名参议员在这封信上签了名,在签署这封信的人中，57人是参议员，其中包括24名共和党人,卢格纳恩是参议员
曼努埃尔和他的团队通过连接马塔莫罗斯和布朗斯维尔的桥梁进入美国,曼努埃尔和他的团队以每天成千上万人的方式进入美国，他们走过马塔莫罗斯和布朗斯维尔之间的桥梁,克里斯·布朗演唱会取消
赛伦斯基此前曾因银行抢劫罪在监狱服刑七年,塞伦斯基因抢劫银行被判入狱七年,40名囚犯谋杀罪服刑
霍华德表示，他对审判希克斯的制度也有信心,霍华德昨日还表示，希克斯将受到公平对待，称他对美国司法系统抱有信心,人管理机构人信心
思科已与AT&T Corp.T.N，SBC Communications Inc.签署了类似的协议。SBC.N和Sprint公,思科与BellSouth竞争对手SBC Communications、AT&T和Sprint Communications有着类似的关系,Microsoft针对漏洞发布一个修补程序漏洞会影响Windows NT 4.0Windows NT 4.0终端服务版Windows 2000Windows XPWindows Server 2003
“我们谴责以美国为首的管理委员会，”穆克塔达·萨德尔(Muqtadaal Sadr)在一座清真寺的布道中说,萨德尔说：“我们谴责并谴责由美国领导的管理委员会。,萨德尔说谴责谴责美国领导管理委员会
在周五发布的一份声明中，28个车臣非政府组织表示，他们将抵制投票,在今天发布的一份声明中，28个车臣非政府组织表示，他们将抵制投票，并警告选民注意舞弊,律师发表一份声明中哈德利说诉讼感到非常高兴
圣保罗董事长兼首席执行官杰伊·S·菲什曼(JayS.Fishman)现年51岁，将担任合并后公司的首席执行官,51岁的杰伊·菲什曼(JayFishman)将担任合并后公司的首席执行官，他是圣保罗大学(St Paul)的董事长兼首席执行官,NatSemi首席执行官布莱恩·哈拉BrianHalla声称这笔交易两家公司都意义
低于50的数字表明制造业在收缩，而高于50的数字表明制造业在扩张,高于50的读数意味着该行业的增长，而低于这一水平的数据则表明该行业收缩,美国股市制造业数据回落
此前，美国国会曾两次通过类似的限制，结果却遭到比尔·克林顿(BillClinton)总统的否决,国会曾两次通过类似的法案，但当时的克林顿总统都否决了这两项法案,曾两次非法闯入逮捕禁止建筑群
他是一副描绘伊拉克逃亡者的卡片中的钻石王牌，这张卡片已经发给了美国军队,他是一张美国牌中的王牌，上面印着被通缉的伊拉克领导人的照片,伊拉克军队宣称提克里特取得胜利
这个岛国5月22日报告了65例新病例，创造了一天的记录，5月23日报告了55例新病例，使台湾成为世界上疫情增长最快的国家,5月22日，台湾报告了65例新病例，创下了一天的新纪录，5月23日报告了55例新病例，使其成为世界上疫情增长最快的国家,周三梅萨县卫生局报告5例西尼罗河病毒人间病例
该公司已扩展到为买家提供其他服务，包括支付服务,该公司扩大了这些基本服务，提供付款，甚至融资,NterpriseLinux服务预计今年年底推出
南非是世界上病例最多的国家，有470万人感染艾滋病毒或艾滋病,南非有470万人感染艾滋病毒或艾滋病，是世界上艾滋病病例最多的国家,伊朗伊斯兰共和国继中国世界上死刑最多国家
Det总督察NormanMcKinlay说，“有证据表明在这一地区有一具或多具尸体”,负责调查的侦探总督察NormanMcKinlay说：“有证据表明在这一地区有一具或多具尸体,偏执狂证据
杰弗里将军说，他将把他在雅鲁拉任职期间的军人抚恤金捐给慈善机构,杰斐瑞少将表示，他将在雅鲁拉大学服役期间，将自己的军人抚恤金捐给慈善机构,女人拉小提琴
他在2001年被自愿阉割，他认为这一手术剥夺了他的性唤起能力,德弗里斯在2001年8月自愿被阉割，他说手术剥夺了他的性唤起能力,英国菲利普亲王做探查性手术
周日，在加油站外排起了长队，人们争先恐后地从提款机那里取钱，以色列人正准备经受住一场可能使国家瘫痪的罢工,星期天，在加油站外排起了长队，人们争先恐后地从提款机里取钱，以色列人正准备迎接罢工的影响,钱
该季度销售额超过预期，同比增长37%，至17.6亿欧元,销售额同比增长37%，至17.6亿辆，超出预期,第二季度销售额增长7%2002年6亿美元增长6.45亿美元
ICC板球经理大卫·理查森(David Richardson)说：“我们还没有决定是使用完整的白线还是虚线，但这是一个值得介绍的实验。,国际刑事法院板球经理戴夫·理查森(DaveRichardson)说：“我们还没有决定是使用完整的白线还是虚线。,男人板球
凯利是一名拥有硕士学位的国家级董事会认证教师，在他30岁的时候，他的薪水是65，000美元,凯利(Kelley)是一位拥有硕士学位的国家级董事会认证教师，在他30年的教学生涯中，他的年薪为65，000美元,哈里斯克莱伯德学校杀害12名学生一名教师
一些女性还担心，很多女性为了追求身体的完美而转向整容手术,一些女性还表达了对这样一个社会的担忧，在这个社会里，越来越多的人为了追求身体的完美而转向整容手术,很多事情
医生们推测，人体自身的雌激素可以保护细胞免受损伤，并改善血液流动,他们的观点是基于雌激素可以防止细胞损伤和改善血液流动的推测,一群细胞
据该团发言人迈克尔·卡尔弗特上尉说，伤亡中没有美国人的报道,团发言人迈克尔·卡尔弗特上尉说，伤亡人员中没有一人是美国人,好消息安然Enron发言人埃里克·梭德EricThode说
世卫组织女发言人玛丽亚·程(Maria Cheng)对此表示赞同，称：“这看起来很像一个孤立的事件。,“这看起来很像一个孤立的事件，”世界卫生组织女发言人MariaCheng说,华盛顿特区阿里尔·迪恩Ariel Dean政治学学位说孤立事件
和解协议包括410万美元的律师费和费用,原告的律师将得到410万美元的和解,上周公司法律代表原告律师会面讨论一项和解协议
现在他想说什么就说什么，“石县护理和康复中心社会主任AleshaBadgley本周说,现在他想说什么就说什么，“斯通县护理和康复中心社会主任AleshaBadgley确认,一个男孩想说消防车
亨特说，疏散工作进展顺利，但乘客没有被告知发生了什么,乘客被顺利疏散，尽管他们没有被告知发生了什么，他说,意大利公共汽车乘客死亡
在一次采访中，海利，一位犯罪学家，承认在这里和全国的立法者的大部分情绪是对死刑的警惕,在一次采访中，身为犯罪学家的希利说，这里和全国各地的许多议员都对死刑抱有戒心,大部分都荷兰人
警方发言人EdwardAritonang准将周六证实，另有两人被捕，一人在雅加达，另一人在中爪哇的Magelang,警方发言人爱德华·阿里托南准将(Brigadier General Edward Aritonang)昨日证实，另有两人被捕，一人在雅加达，另一人在中爪哇的马格朗(Magelang),西澳男子警方毒品中被捕
还选出了五名候补陪审员，最后一名将于星期五上午从小组中选出,还选出了五名候补陪审员，第六名候补陪审员将于星期五选出,印尼人激烈竞选中投票选出总统
劳工部分析师认为，来自企业调查的工资统计数据提供了更准确的经济图景，因为调查数据基于更大的样本,分析师们表示，他们认为薪资统计数据提供了更准确的经济状况，因为它们基于更大的样本,这一汤姆森第一电话公司ThomsonFirstCall调查分析师预测低3美分
这项研究发现，在过去的几十年里，在每100个鱼钩中钓到10条鱼的地方，他们现在很幸运地钓到了一条鱼,迈尔斯说：“过去，每100个鱼钩能钓到10条鱼，而现在他们幸运地钓到了一条鱼。,两个人沼泽地钓到一条鱼
道琼工业指数收高41.61点，或0.44%，收报9，415.82点,道琼斯指数周五上涨41.61点，当日上涨0.4%，本周上涨0.7%,道琼工业指数收高13.33点0.15%收报9196.55点
班克黑德说，犯罪现场表明凶手“非常有条理”,GBI发言人约翰·班克黑德(JohnBankhead)表示，谋杀现场表明凶手非常有条理,格洛弗说凶手用来勒死受害者韧带上一个活结
微软发言人肖恩·桑德威尔(SeanSundwell)表示：“我们与@STOCK的内部人事决定无关。,“微软绝对与AtStake的内部人事决定无关，”Sundwall说,民主自由无关
IAC的股价昨日收盘下跌2.81美元，至34.19美元，跌幅7.6%,InterActiveCorp的股价收于34.19美元，在纳斯达克市场下跌2.81美元，跌幅7.6%,甲骨文股价下跌27美分跌幅2%13.09美元
司法部说，“只有不到10个”的联邦调查局办公室进行了涉及访问清真寺的调查,此外，司法部说，联邦调查局已经进行了“不到10”的调查，涉及访问清真寺,司法部说联邦调查局不到10调查涉及访问清真寺
密歇根大学校长玛丽·苏·科尔曼(MarySue Coleman)在该大学网站上发表声明称，“我们的基本价值观没有改变,“我们的基本价值观没有改变，”该大学校长玛丽·苏·科尔曼(Mary Sue Coleman)在安娜堡的一份声明中说,周三李·博伊德·马尔沃Lee Boyd Malvo传唤同案狙击手约翰·艾伦·穆罕默德JohnAllen Muhammad预审听证会证人
加州大学伯克利分校法学教授查尔斯·魏瑟伯格(CharlesWeisselberg)说：“当你越界时，你侵犯了宪法规定的权利。,在加州大学伯克利分校教授法律的CharlesWeisselberg说：“当你越界时，你侵犯了宪法规定的权利。,法官裁定马丁内斯痛苦尖叫时反复询问警察主管侵犯第五修正案权利
卡尔森周二表示，他不会回避此案,服务官员说，卡尔森拒绝回避这一案件,朝鲜回避谈判提议
往好的方面看，可口可乐公司。纽约证券交易所代码：Ko-News-People)周四早些时候公布，在欧洲需求的推动下，该季度实现了更高的利润,可口可乐公司周四早些时候，在欧洲需求的推动下，该季度公布了更高的利润,拉姆布斯公司纳斯达克NasdaqRMBSNewsPeople暴涨38%纳斯达克市场涨幅公司
作为交易的一部分，德莱尼同意在继续调查中给予合作,戴夫·德莱尼同意与联邦检察官合作，以换取认罪,希望纽约市同意合作真诚讨论
但其他知情人士表示，维旺迪正在为进一步的竞购敞开大门，并希望看到对个别资产感兴趣的竞购者组成团队,但其他知情人士表示，维旺迪将在接下来的一两天内继续为进一步投标敞开大门,看涨债券人士希望美联储风险倾向经济疲软
美国检察官已经逮捕了130多人，并缴获了1，700多万美元，这是对互联网欺诈和滥用行为的持续打击,周五，美国三个政府机构宣布，在一次网络欺诈行动中，130多人被捕，价值1700万美元的财产被没收,朝鲜美国新制裁打击
美国之旅项目负责人吉姆·威廉姆斯(JimWilliams)表示，到11月中旬，许多抵达亚特兰大的乘客将会被指纹和拍照,访美项目主管吉姆·威廉姆斯(JimWilliams)表示，到11月中旬，检查人员将对许多抵达亚特兰大的外国乘客进行指纹识别和拍照,美国免除乘客巴基斯坦援助
听证会召开前一天，五角大楼第一次挑出一名官员达拉格(Dallager)，称他没有处理这起丑闻,就在听证会召开的前一天，五角大楼首次挑出一名官员-达拉格(Dallager)-未能处理这起丑闻,五角大楼导弹残骸
人口下降的县将是维拉百万、波西和麦迪逊,维龙县、波西县和麦迪逊县的人口将减少,中国网络人口6.18亿
内罗毕全圣大教堂教务长彼得·卡拉尼亚牧师(Rev.Peter Karanja)说，圣公会“正在疏远自己与圣公会的关系”,在内罗毕，所有圣徒大教堂的教务长彼得·卡拉尼亚(Peter Karanja)牧师表示，美国主教教会正在疏远圣公会,大主教管区发言人克里斯托弗·J·科因牧师RevChristopherJCoyne周五不愿置评
当炸弹在Casa de España爆炸时，顾客们正在吃晚饭和玩宾果游戏,在Casa de Espaa，当炸弹爆炸时，顾客们正在吃晚饭和玩宾果游戏,那人办公室里玩Haki sak游戏
普洛夫斯基说，委员会不会进行调查，因为三年的诉讼时效已经到期,小组将不会开始正式的调查，因为诉讼时效已经过了，Plofsky说,哥伦比亚事故调查委员会一名成员哈伯德说这使更接近说泡沫损害
斯奎尔斯是雅典娜有效载荷的首席调查员，这是每个漫游者携带的科学仪器的集合,康奈尔大学(Cornell University)科学家史蒂夫·斯奎尔斯(SteveSquyres)是这些任务的科学仪器的首席研究员,这是常识演绎推理
律师和其他熟悉联邦调查的人说，联邦调查仍然集中在坎贝尔身上，但检察官拒绝讨论这一调查,尽管联邦检察官拒绝讨论这项调查，但律师和其他知情人士表示，调查仍集中在坎贝尔身上,莫里斯说那辆卡车坎贝尔斯溪地区发现符合这一描述
周三，道奇队在道奇体育场的25332名观众面前，以3比2击败科罗拉多队，赢得了自2001年以来最长的连胜纪录,道奇队在过去的九场比赛中连续第六场和第七场比赛获胜，他们在周三的比赛中以3-2击败了科罗拉多队，在多德格体育场的25，332名观众面前,安娜队尚未参加州选举
萨赫勒表示，警方已确认了14人牢房中7具尸体的身份，据信这些人在周六几乎同时发动了5起袭击,他说，警方已经确认了14名袭击者中的7人的尸体，这些人在周五晚上几乎同时发动了5次袭击,7人伊拉克袭击中丧生
密歇根大学今天公布了一项新的招生政策，此前美国最高法院在6月份否决了以前录取本科生的方式,密歇根大学计划周四公布一项新的本科生录取政策，该政策在6月份被美国最高法院驳回,以色列公布建造新定居者住房计划
克里普斯-普拉瓦克上周五离开，两天前，该部门提出了一项计划，通过医生办公室分销医用大麻,医疗服务办公室主任辛迪·克里普斯-普拉瓦克(Cindy Cripps-Prawak)在该部门提出一项通过医生办公室分销大麻的计划后离职,有人锅里倒大麻
Morgenthau说，2001年和2002年间，BeaconHill的40个账户中只有4个账户的电汇总额超过32亿美元,Morgenthau说，2001年至2002年，在BeaconHill开设的40个账户中，有4个账户的电汇总额超过32亿美元,检察官说2001年2002年公司40账户中4账户电汇总额超过32亿美元
该法案规定，堕胎的妇女不能被起诉,根据该法案，不能对堕胎的妇女提出起诉,反对堕胎人不希望妇女选择堕胎
施瓦辛格在与国会共和党人会晤后说：“我来华盛顿基本上是为了建立关系，并确保我们得到更多的联邦资金给加州。,“我来华盛顿基本上是为了建立关系，并确保我们得到更多的联邦资金，”施瓦辛格在一次会议后说,新法律图书馆学校过滤器联邦资金
与这场狂欢有关的另一起枪击事件发生在11月11日，地点在奥贝茨的汉密尔顿中央小学，距离高速公路大约两英里,与这场狂欢有关的最新一起枪击事件是11月11日发生在奥贝茨的汉密尔顿镇小学的枪击案，该校距离高速公路约两英里,医生计划11月14日提前两周分娩
周二，中国央行按预期保持利率稳定，但同时宣布，总体风险趋于疲软，并警告通缩风险,正如人们普遍预期的那样，央行的政策委员会暂时保持利率不变，但宣布总体风险趋于疲软，这令市场感到意外,安南警告叙利亚会谈面临风险
这些官员没有说明美国部队是否进入叙利亚领土，也没有说明叙利亚边防部队是如何介入的,美国官员没有说明，根据情报采取行动的美国军队是否进入了叙利亚领土，并对叙利亚警卫是如何介入的含糊其辞,叙利亚部队发动阿勒颇袭击
她说，德鲁斯目前仍被关在监狱里，目前处于隔离状态,德鲁斯昨晚被单独关押在同一所监狱里,6800人隔离数千名医护人员工作隔离
Palm周三宣布了收购HandSpring的计划，该公司由杰夫·霍金斯(JeffHawkins)创办，被许多人视为Palm掌上电脑的父亲,Palm周三表示，计划收购叛逆者Palm联合创始人杰夫·霍金斯(JeffHawkins)创建的HandSpring公司,MediaQ客户包括手持设备制造商三菱西门子Palm夏普飞利浦戴尔索尼
在棉兰老岛发生包括三起爆炸事件在内的一系列袭击事件后，政府最近搁置了与由马来西亚斡旋的摩洛伊斯兰解放阵线(MILF)的和谈,在一系列针对棉兰老岛的袭击(包括三起致命的爆炸)后，马来西亚政府最近搁置了由邻国马来西亚促成的和谈，并将此事归咎于摩洛伊斯兰解放阵线(MILF),伊拉克迪亚拉发生三起汽车爆炸事件至少13人死亡
工会还没有透露哪一条链将成为攻击目标,工会表示，它将在晚些时候公布哪一条连锁店将成为攻击目标,连续三年未能国家目标学校提供转学外还提供辅导
土耳其当局说，所有的自杀炸弹手都是土耳其人,安卡拉说，四名自杀式袭击者都是土耳其人,一名女性自杀炸弹手俄罗斯车站炸死16人
从佛罗里达到阿拉斯加，成千上万的狂欢者发誓要争取更多的合法权利，包括同性婚姻,成千上万的狂欢者在庆祝这一决定时，发誓要争取更多的合法权利，包括同性婚姻,新西兰同性婚姻不
此外，h2210的摇篮还有空间为第二个电池充电,h2200的底座具有为第二电池充电的空间,电能都来自电池
霍华德说：“执法机构与情报机构的紧密合作，是目前反恐斗争的核心。,他说，区域执法机构和情报部门之间的密切合作是打击恐怖主义的核心,等待变得更紧密
这位母亲还在诉讼中声称，她受到其中一名看守的性侵犯,该名母亲还声称，在1998年的对抗中，她遭到其中一名看守的性侵犯,律师发表一份声明中哈德利说诉讼感到非常高兴
周日，一场热带风暴在墨西哥湾迅速发展，预计将在周一晚上袭击德克萨斯州或路易斯安那州海岸的某个地方,周日，一场热带风暴在墨西哥湾迅速发展，当它在周一晚上袭击路易斯安那州海岸的某个地方时，可能会有飓风风力,热带风暴凯伦袭击美国墨西哥湾沿岸
脑膜炎是一种脊髓液体和大脑周围组织的感染,脑膜炎是一种液体的感染，在一个人的脊髓和周围的大脑,进化一种观点一种信仰
驻伦敦的NCRI官员阿里·萨法维(AliSafavi)对路透社表示：“我们谴责这次袭击，我们认为这是非法的，在道义上和政治上都是不合理的。,总部位于伦敦的NCRI官员阿里·萨法维(AliSafavi)在电话中对路透社表示：“我们谴责这次袭击，我们认为这是非法的，在道义上和政治上都是不合理的。,巴基斯坦谴责美国无人机袭击
联邦贸易委员会(FTC)今天要求国会给予更多的权力来打击不想要的互联网垃圾邮件，这些垃圾邮件现在占所有电子邮件流量的一半,联邦贸易委员会(FederalTradeCommission)昨日要求国会授予更广泛的权力，以应对迅速增长的垃圾邮件问题。新的研究显示，垃圾邮件占所有电子邮件流量的一半,不想要一个在乎总统
一直反对这些行动的人现在正试图找到新的理由来说这不是正确的做法。,“这里发生的情况是，一直反对这一行动的人正试图找到新的理由，解释为什么这不是正确的做法。,找到证据
世界排名第二的莱顿·休伊特指控网球专业人员协会(AssociationofTennisProfessionals)怀有恶意，包括去年被指控试图欺骗他拒绝药物测试,世界排名第二的莱顿·休伊特指责他的职业同龄人长期怀有恶意，包括去年试图欺骗他拒绝药物测试,加拿大火车阴谋嫌疑人拒绝指控
在这件事上，我承认我的行为不当。,“我承认我的行为不当，”他说,美国承认叙利亚反对派
发言人说：“自十一月起，我们已与警方通力合作,它补充说，自去年11月以来，它一直与警方“充分合作”,说5月初该市已收到1400份报告
